{
  "current": {
    "visitors": 1,
    "sessions": 1,
    "product_views": 0,
    "cart_adds": 0,
    "checkouts": 0,
    "contacts": 0,
    "leads": 0,
    "orders_created": 0,
    "orders_paid": 0,
    "manual_sales": 0,
    "money": [],
    "session_to_lead": null,
    "session_to_paid_sale": null,
    "lead_to_paid_sale": null,
    "checkout_to_paid_order": null,
    "first_visit_to_lead_seconds": null,
    "first_visit_to_paid_sale_seconds": null
  },
  "previous": {
    "visitors": 0,
    "sessions": 0,
    "product_views": 0,
    "cart_adds": 0,
    "checkouts": 0,
    "contacts": 0,
    "leads": 0,
    "orders_created": 0,
    "orders_paid": 0,
    "manual_sales": 0,
    "money": [],
    "session_to_lead": null,
    "session_to_paid_sale": null,
    "lead_to_paid_sale": null,
    "checkout_to_paid_order": null,
    "first_visit_to_lead_seconds": null,
    "first_visit_to_paid_sale_seconds": null
  },
  "delta": {
    "visitors": { "abs": 1, "pct": null },
    "sessions": { "abs": 1, "pct": null },
    "product_views": { "abs": 0, "pct": null },
    "cart_adds": { "abs": 0, "pct": null },
    "checkouts": { "abs": 0, "pct": null },
    "contacts": { "abs": 0, "pct": null },
    "leads": { "abs": 0, "pct": null },
    "orders_created": { "abs": 0, "pct": null },
    "orders_paid": { "abs": 0, "pct": null },
    "manual_sales": { "abs": 0, "pct": null },
    "money": [],
    "session_to_lead": { "abs": null, "pct": null },
    "session_to_paid_sale": { "abs": null, "pct": null },
    "lead_to_paid_sale": { "abs": null, "pct": null },
    "checkout_to_paid_order": { "abs": null, "pct": null },
    "first_visit_to_lead_seconds": { "abs": null, "pct": null },
    "first_visit_to_paid_sale_seconds": { "abs": null, "pct": null }
  },
  "payment_methods": {
    "current": [],
    "previous": [],
    "delta": []
  }
}
